{
  "task": "fixture-task",
  "date": "2026-07-14T00:00:00Z",
  "status": "NO-GO",
  "round": 3,
  "cycle": 1,
  "qa_no_go_round": 2,
  "rounds_audit": [
    { "round": 1, "date": "2026-07-12T00:00:00Z", "verdict": "NO-GO", "causes": ["gate-failure"], "qualifying": true },
    { "round": 2, "date": "2026-07-13T00:00:00Z", "verdict": "NO-GO", "causes": ["spec-check-failure"], "qualifying": true },
    { "round": 3, "date": "2026-07-14T00:00:00Z", "verdict": "NO-GO", "causes": ["cross-runtime-discrepancy"], "qualifying": false }
  ],
  "cross_runtime": {}
}
